{
  "totalRecords": 167,
  "meta": {
    "generatedAt": "2024-07-30T10:30:00Z",
    "source": "issues_data"
  },
  "zoneIssueConcentration": {
    "description": "Per-zone breakdown of total open issues and distinct auditees contributing those issues, with average issues per auditee. Sorted descending by avgIssuesPerAuditee to surface the zone with the highest issue concentration.",
    "zones": [
      {
        "zoneName": "North Zone",
        "totalIssues": 42,
        "distinctAuditees": 10,
        "avgIssuesPerAuditee": 4.2
      },
      {
        "zoneName": "West Zone",
        "totalIssues": 48,
        "distinctAuditees": 12,
        "avgIssuesPerAuditee": 4
      },
      {
        "zoneName": "South Zone",
        "totalIssues": 45,
        "distinctAuditees": 15,
        "avgIssuesPerAuditee": 3
      },
      {
        "zoneName": "East Zone",
        "totalIssues": 20,
        "distinctAuditees": 8,
        "avgIssuesPerAuditee": 2.5
      },
      {
        "zoneName": "Central Zone",
        "totalIssues": 12,
        "distinctAuditees": 7,
        "avgIssuesPerAuditee": 1.7
      }
    ]
  },
  "topGroupsByIssues": {
    "description": "Top 3 groups by total issue count, with their corresponding audit type names.",
    "top3": [
      {
        "groupName": "IT Security Division",
        "auditTypeName": "Technology Audit",
        "issueCount": 35
      },
      {
        "groupName": "Supply Chain Management",
        "auditTypeName": "Operational Audit",
        "issueCount": 28
      },
      {
        "groupName": "Customer Service Dept",
        "auditTypeName": "Compliance Audit",
        "issueCount": 22
      }
    ]
  },
  "topAuditeesByCriticalIssues": {
    "description": "Top 3 auditees by combined High + Zero Tolerance issue count, with individual breakdown of each risk level.",
    "totalCriticalIssues": 45,
    "top3": [
      {
        "auditeeName": "Hyderabad Corporate Office",
        "highCount": 10,
        "zeroToleranceCount": 5,
        "combinedCriticalCount": 15
      },
      {
        "auditeeName": "Chennai Regional Hub",
        "highCount": 8,
        "zeroToleranceCount": 4,
        "combinedCriticalCount": 12
      },
      {
        "auditeeName": "Bengaluru Data Center",
        "highCount": 7,
        "zeroToleranceCount": 3,
        "combinedCriticalCount": 10
      }
    ]
  }
}