{
  "totalRecords": 138,
  "meta": {
    "generatedAt": "2024-07-25T10:30:00Z",
    "source": "issues_data_v4"
  },
  "zoneIssueConcentration": {
    "description": "Per-zone breakdown of total open issues and distinct auditees contributing those issues, with average issues per auditee. Sorted descending by avgIssuesPerAuditee to surface the zone with the highest issue concentration.",
    "zones": [
      {
        "zoneName": "North Zone",
        "totalIssues": 35,
        "distinctAuditees": 10,
        "avgIssuesPerAuditee": 3.5
      },
      {
        "zoneName": "West Zone",
        "totalIssues": 28,
        "distinctAuditees": 8,
        "avgIssuesPerAuditee": 3.5
      },
      {
        "zoneName": "South Zone",
        "totalIssues": 40,
        "distinctAuditees": 12,
        "avgIssuesPerAuditee": 3.3
      },
      {
        "zoneName": "Central Zone",
        "totalIssues": 15,
        "distinctAuditees": 5,
        "avgIssuesPerAuditee": 3
      },
      {
        "zoneName": "East Zone",
        "totalIssues": 20,
        "distinctAuditees": 7,
        "avgIssuesPerAuditee": 2.9
      }
    ]
  },
  "topGroupsByIssues": {
    "description": "Top 3 groups by total issue count, with their corresponding audit type names.",
    "top3": [
      {
        "groupName": "Operations Excellence Dept",
        "auditTypeName": "Operational Audit",
        "issueCount": 30
      },
      {
        "groupName": "Financial Control Unit",
        "auditTypeName": "Financial Audit",
        "issueCount": 22
      },
      {
        "groupName": "HR & Compliance Division",
        "auditTypeName": "Compliance Audit",
        "issueCount": 18
      }
    ]
  },
  "topAuditeesByCriticalIssues": {
    "description": "Top 3 auditees by combined High + Zero Tolerance issue count, with individual breakdown of each risk level.",
    "totalCriticalIssues": 41,
    "top3": [
      {
        "auditeeName": "Bengaluru Innovation Hub",
        "highCount": 8,
        "zeroToleranceCount": 5,
        "combinedCriticalCount": 13
      },
      {
        "auditeeName": "Chennai Tech Park",
        "highCount": 7,
        "zeroToleranceCount": 3,
        "combinedCriticalCount": 10
      },
      {
        "auditeeName": "Hyderabad Data Center",
        "highCount": 6,
        "zeroToleranceCount": 2,
        "combinedCriticalCount": 8
      }
    ]
  }
}